category,subcategory,name,specification,text message,option 1,option 2,option 3,option 4,option 5,option 6,option 7,option 8,option 9,option 10,name of flow,flow id,node id
Content,Positive,CheckIn,Praise,Did you praise your child during one-on-one time or any other time during the day? ,Yes,No,,,,,,,,,PLH - Content - Positive - CheckIn - Praise,42a4058e-376b-412b-9851-4fbb15f3a606,0bdc1b14-567a-4800-b978-cc985cc24f97
Content,Positive,CheckIn,Praise,"Sorry, I don't understand what you mean.",,,,,,,,,,,PLH - Content - Positive - CheckIn - Praise,42a4058e-376b-412b-9851-4fbb15f3a606,09fd1eb3-9588-4768-ae1e-6382dcac0157
Content,Positive,CheckIn,Praise,"It can be hard sometime to remember. Next time you spend one-on-one time, try and think of one thing you can praise them for. You can even say “thank you for spending time with me!”.",,,,,,,,,,,PLH - Content - Positive - CheckIn - Praise,42a4058e-376b-412b-9851-4fbb15f3a606,98b8faa1-ce1f-4489-9381-6a03d4294434
Content,Positive,CheckIn,Praise,"Well done, great job for remembering. How did your child or teen respond?",Surprised,Happy,My child did not like it,I don't know,,,,,,,PLH - Content - Positive - CheckIn - Praise,42a4058e-376b-412b-9851-4fbb15f3a606,8a07592d-85a7-48a1-99ec-5e684725d4b7
Content,Positive,CheckIn,Praise,"Sorry, I don't understand what you mean.",,,,,,,,,,,PLH - Content - Positive - CheckIn - Praise,42a4058e-376b-412b-9851-4fbb15f3a606,15d93bfa-3de6-453c-a9d5-c4ab0d3083bb
Content,Positive,CheckIn,Praise,"Remember, it takes some time for your child or teen to get used to you praising them. The more time you spend with them, the better it will go!",,,,,,,,,,,PLH - Content - Positive - CheckIn - Praise,42a4058e-376b-412b-9851-4fbb15f3a606,94a6cd5b-f0d2-4d7e-8c0f-bc63b8dd21a5
Content,Positive,CheckIn,Praise,"Well done for noticing how your child or teen felt, keep it up!",,,,,,,,,,,PLH - Content - Positive - CheckIn - Praise,42a4058e-376b-412b-9851-4fbb15f3a606,9b57e73a-86cb-44a0-ab80-91f1338ffcf2
Content,Positive,CheckIn,Praise,"No problem, try to notice how they respond next time!",,,,,,,,,,,PLH - Content - Positive - CheckIn - Praise,42a4058e-376b-412b-9851-4fbb15f3a606,cdbc9378-1e88-48f7-992a-1d47f685a3eb
Content,Positive,CheckIn,Praise,"It happens, just be patient. Make sure to keep spending time with your child or teen, so they will value your opinion more and more. When your praise is genuine, you will see the benefits soon!",,,,,,,,,,,PLH - Content - Positive - CheckIn - Praise,42a4058e-376b-412b-9851-4fbb15f3a606,09f7871b-2610-41be-b27e-6e8667e4cb10